{
  "$schema": "../schemas/attack_registry.schema.json",
  "schema_version": "1.0.0",
  "registry_version": "1.1.0",
  "registry_id": "navier.attack_registry",
  "base_revision": "81448ed3e488b8b7d357ce430d52df4434f0c9cd",
  "generated_at": "2026-07-15T04:33:42Z",
  "ssot": true,
  "research_program": {
    "id": "research.navier_stokes_3d",
    "title": "Parallel evidence-gated attack on the three-dimensional Navier-Stokes Navier--Stokes problem",
    "summary": "The research_program tracks Fefferman A and C as distinct exact endpoints and forbids conditional, numerical, or wrong-domain evidence from being promoted to a endpoint resolution.",
    "global_disposition": "SCAFFOLDED",
    "scientific_status": "SCIENTIFIC_FRONTIER",
    "problem_surface": {
      "equation": "INCOMPRESSIBLE_NAVIER_STOKES",
      "dimension": 3,
      "geometry": "R3",
      "boundary": "NONE",
      "viscosity": "POSITIVE",
      "viscosity_quantifier": "FOR_EVERY_FIXED_POSITIVE",
      "initial_data": "SMOOTH_DIVERGENCE_FREE_RAPID_DECAY",
      "formal_path": "Navier/Problem.lean",
      "primary_branch": "FEFFERMAN_A",
      "resolution_branches": [
        {
          "id": "FEFFERMAN_A",
          "forcing": "ZERO",
          "target": "GLOBAL_SMOOTH_FINITE_ENERGY",
          "obligation_id": "endpoint.fefferman_a",
          "public_declaration": "Navier.ProblemStatements.WholeSpaceGlobalRegularity",
          "planned_formal_target": null
        },
        {
          "id": "FEFFERMAN_C",
          "forcing": "SMOOTH_RAPID_DECAY",
          "target": "NO_GLOBAL_PHYSICALLY_REASONABLE_SOLUTION",
          "obligation_id": "endpoint.fefferman_c",
          "public_declaration": "Navier.ProblemStatements.WholeSpaceBreakdown",
          "planned_formal_target": null
        }
      ]
    },
    "resolution_mode": "ANY",
    "resolution_obligation_ids": [
      "endpoint.fefferman_a",
      "endpoint.fefferman_c"
    ]
  },
  "barriers": [
    {
      "id": "barrier.endpoint_semantics",
      "title": "Exact official endpoint semantics",
      "description": "A route must preserve the dimension, whole-space geometry, viscosity, data class, branch-specific forcing, and exact A or C conclusion.",
      "primary_reference_ids": [
        "ref.problem_statement.fefferman2000"
      ]
    },
    {
      "id": "barrier.scaling_criticality",
      "title": "Scaling-critical control barrier",
      "description": "Subcritical estimates do not control the three-dimensional scaling-critical quantities needed at a candidate singularity.",
      "primary_reference_ids": [
        "ref.kato.1984",
        "ref.ess.2003"
      ]
    },
    {
      "id": "barrier.supercritical_energy_gap",
      "title": "Supercritical energy gap",
      "description": "The global energy inequality is too weak under Navier-Stokes scaling to exclude concentration at small spatial and temporal scales.",
      "primary_reference_ids": [
        "ref.leray.1934"
      ]
    },
    {
      "id": "barrier.compactness_defect",
      "title": "Compactness and rigidity defect",
      "description": "Critical sequences may lose compactness through translation, scaling, or frequency escape, and a limiting critical element still needs a rigidity contradiction.",
      "primary_reference_ids": [
        "ref.gallagher.koch.planchon2013"
      ]
    },
    {
      "id": "barrier.nonlocal_pressure",
      "title": "Nonlocal pressure barrier",
      "description": "Pressure couples distant scales and regions, so local velocity estimates must retain the exact pressure decomposition required by regularity theory.",
      "primary_reference_ids": [
        "ref.ckn.1982"
      ]
    },
    {
      "id": "barrier.weak_strong_gap",
      "title": "Weak-to-strong solution gap",
      "description": "Global weak existence does not imply uniqueness or smoothness, and conditional weak-strong criteria must not be presented as unconditional upgrades.",
      "primary_reference_ids": [
        "ref.leray.1934",
        "ref.ess.2003"
      ]
    },
    {
      "id": "barrier.numerical_nonproof",
      "title": "Numerical evidence is not proof",
      "description": "Finite grids, floating-point trajectories, and parameter sweeps are observations and cannot realize a theorem, bridge, payload, or problem endpoint.",
      "primary_reference_ids": [
        "ref.problem_statement.fefferman2000"
      ]
    },
    {
      "id": "barrier.endpoint_circularity",
      "title": "Endpoint and bridge circularity",
      "description": "A continuation criterion, critical bound, compactness element, or breakdown profile cannot be assumed in a wrapper whose conclusion is the same endpoint.",
      "primary_reference_ids": [
        "ref.problem_statement.fefferman2000",
        "ref.ess.2003"
      ]
    }
  ],
  "references": [
    {
      "id": "ref.problem_statement.fefferman2000",
      "kind": "PRIMARY",
      "citation": "Charles L. Fefferman, Existence and Smoothness of the Navier-Stokes Equation, problem-statement Mathematics Institute problem description.",
      "year": 2000,
      "locator": "problem_statement:navier-stokes-fefferman-official-2000",
      "relevance": "Defines the exact whole-space alternatives A and C, including their distinct forcing quantifiers and solution conclusions."
    },
    {
      "id": "ref.leray.1934",
      "kind": "PRIMARY",
      "citation": "Jean Leray, Sur le mouvement d'un liquide visqueux emplissant l'espace, Acta Mathematica 63.",
      "year": 1934,
      "locator": "doi:10.1007/BF02547354",
      "relevance": "Establishes the global finite-energy weak-solution framework and exposes the gap between energy control and smooth uniqueness."
    },
    {
      "id": "ref.kato.1984",
      "kind": "PRIMARY",
      "citation": "Tosio Kato, Strong Lp-solutions of the Navier-Stokes equation in Rm, with applications to weak solutions, Mathematische Zeitschrift 187.",
      "year": 1984,
      "locator": "doi:10.1007/BF01174182",
      "relevance": "Provides a critical-space local mild-solution and continuation framework for the exact equation."
    },
    {
      "id": "ref.koch.tataru2001",
      "kind": "PRIMARY",
      "citation": "Herbert Koch and Daniel Tataru, Well-Posedness for the Navier-Stokes Equations, Advances in Mathematics 157.",
      "year": 2001,
      "locator": "doi:10.1006/aima.2000.1937",
      "relevance": "Establishes critical BMO-minus-one well-posedness and separates global small-data control from the unresolved arbitrary-data problem."
    },
    {
      "id": "ref.prodi.1959",
      "kind": "PRIMARY",
      "citation": "Giovanni Prodi, Un teorema di unicità per le equazioni di Navier-Stokes, Annali di Matematica Pura ed Applicata 48, 173-182.",
      "year": 1959,
      "locator": "doi:10.1007/BF02410664",
      "relevance": "Introduces an integrability criterion separating conditional regularity from the unresolved unconditional bound."
    },
    {
      "id": "ref.serrin.1962",
      "kind": "PRIMARY",
      "citation": "James Serrin, On the interior regularity of weak solutions of the Navier-Stokes equations, Archive for Rational Mechanics and Analysis 9.",
      "year": 1962,
      "locator": "doi:10.1007/BF00253344",
      "relevance": "Gives the scale of conditional space-time regularity criteria used by the critical-norm lane."
    },
    {
      "id": "ref.ess.2003",
      "kind": "PRIMARY",
      "citation": "Luis Escauriaza, Gregory Seregin, and Vladimir Sverak, L3,infinity-solutions of Navier-Stokes equations and backward uniqueness, Russian Mathematical Surveys 58.",
      "year": 2003,
      "locator": "doi:10.1070/RM2003v058n02ABEH000609",
      "relevance": "Establishes endpoint conditional regularity from bounded critical L-infinity-in-time L3 control."
    },
    {
      "id": "ref.ckn.1982",
      "kind": "PRIMARY",
      "citation": "Luis Caffarelli, Robert Kohn, and Louis Nirenberg, Partial regularity of suitable weak solutions of the Navier-Stokes equations, Communications on Pure and Applied Mathematics 35.",
      "year": 1982,
      "locator": "doi:10.1002/cpa.3160350604",
      "relevance": "Supplies the suitable-weak-solution and epsilon-regularity architecture while leaving global singularity exclusion open."
    },
    {
      "id": "ref.gallagher.koch.planchon2013",
      "kind": "PRIMARY",
      "citation": "Isabelle Gallagher, Gabriel S. Koch, and Fabrice Planchon, A profile decomposition approach to the L^∞_t(L^3_x) Navier-Stokes regularity criterion, Mathematische Annalen 355.",
      "year": 2013,
      "locator": "doi:10.1007/s00208-012-0830-0",
      "relevance": "Develops profile decomposition and critical-element machinery for a Navier-Stokes regularity criterion."
    },
    {
      "id": "ref.tao.2019",
      "kind": "PRIMARY",
      "citation": "Terence Tao, Quantitative bounds for critically bounded solutions to the Navier-Stokes equations, arXiv preprint.",
      "year": 2019,
      "locator": "arxiv:1908.04958v2",
      "relevance": "Provides quantitative critical-norm and frequency-localized structure relevant to cascade exclusion."
    },
    {
      "id": "ref.constantin.fefferman1993",
      "kind": "PRIMARY",
      "citation": "Peter Constantin and Charles Fefferman, Direction of vorticity and the problem of global regularity for the Navier-Stokes equations, Indiana University Mathematics Journal 42.",
      "year": 1993,
      "locator": "journal:iumj-42-3-constantin-fefferman-1993",
      "relevance": "Relates geometric depletion of vortex stretching to conditional regularity without supplying unconditional alignment."
    },
    {
      "id": "ref.foias.temam1989",
      "kind": "PRIMARY",
      "citation": "Ciprian Foias and Roger Temam, Gevrey Class Regularity for the Solutions of the Navier-Stokes Equations, Journal of Functional Analysis 87.",
      "year": 1989,
      "locator": "doi:10.1016/0022-1236(89)90015-3",